,EpisodeID,Names
0,s10e02,"Nadiya Hussain, Diane Morgan, Bob Mortimer, Michael Smiley"
1,s10e06,"Rhod Gilbert, Jamie Laing, Tracy-Ann Oberman, Claudia Winkleman"
2,s10e05,"Josh Widdicombe, Brian Blessed, Professor Kate Williams, Kevin Bishop"
3,s10e03,"Sara Cox, Jason Manford, Nick Robinson, Harry Shearer"
4,s10e04,"Warwick Davis, Hugh Dennis, Katherine Ryan, John Simpson"
5,s10e01,"Mel Giedroyc, David Haye, Martin Kemp, Romesh Ranganathan"
6,s10e07,"Clara Amfo, Tom Davis, Shaun Ryder, Henning Wehn"
7,s10e09,The Unseen Bits
8,s10e08,"Maggie Aderin Pocock, Phil Wang, Jason Watkins, Adam Woodyatt"
