,EpisodeID,Names
0,s07e02,"Charles Dance, Stephen Mangan, Isy Suttie, Gok Wan"
1,s07e03,"Joan Bakewell, Warwick Davis, Paul Hollywood, Jason Manford"
2,s07e08,"Jimmy Carr, Griff Rhys Jones, Dave Myers, Susanna Reid"
3,s07e07,"Greg Rutherford, Kirsty Young, Joanna Scanlan, Henning Wehn"
4,s07e09,The Unseen Bits
5,s07e06,"Sarah Millican, Jon Richardson, David Harewood, Bob Mortimer"
6,s07e01,"Rhod Gilbert, Vernon Kay, Dara Ó Briain, Denise Van Outen"
7,s07e05,"Susan Calman, Richard Osman, Carol Kirkwood, David O'Doherty"
8,s07e04,"Matt Dawson, Mel Giedroyc, Josh Widdicombe, Dermot O'Leary"
